9,James Taylor says he learning to trust his heart again after having an internal defibrillator surgically fitted last year to help deal with an irregular heartbeat.,bbc-sport
9,"Farid El Alagui's header is enough for Ayr United to beat Raith Rovers, who bizarrely had to play midfielder Ryan Stevenson as goalkeeper.",bbc-sport
9,World number one Andy Murray beats Tunisia's Malek Jaziri at the Dubai Championships in his first match for six weeks.,bbc-sport
6,President Donald Trump outlined some very broad strokes of his budget proposal during remarks in Washington Monday.,cnn
9,Blackburn Rovers boost their Championship survival chances with a gutsy victory over Derby County at Ewood Park.,bbc-sport
9,Jonathan Joseph is recalled to the England squad for their training camp ahead of next weekend's Six Nations meeting with Scotland.,bbc-sport
3,Chinese parcel billionaires have amassed a total net worth of about $47 billion.,bloomberg
6,"Ian Pannell reports from the city of Baltimore, where 25% of the population lives in poverty.",bbc-news
10,Travis Kalanick tells a driver to take responsibility for his problems and boasts about a tough culture.,bloomberg
6,U.S. Supreme Court Justice Ruth Bader Ginsburg always hugged President Barack Obama before his speeches to Congress. She doesn’t even plan to attend President Donald Trump’s first one.,bloomberg
13,"Oscar Insurance Corp., the startup trying to reinvent medical insurance with its Obamacare-focused plans, lost more than $200 million on the products in 2016 as it heads into a year that may see the undoing of the health law.",bloomberg
13,"Donald Trump’s first five weeks on the job have been pretty good for the stock market. By one measure, investors haven’t seen anything yet.",bloomberg
13,House Speaker Paul Ryan has won over an unlikely ally to salvage his controversial tax plan: Steve Bannon.,bloomberg
13,There are plenty of reasons to buy into Snap Inc.’s initial public offering. The larger question is whether investors will want to stick around.,bloomberg
13,"Time Inc. asked potential suitors to submit acquisition offers by next week, according to people familiar with the matter.",bloomberg
6,"Former Kentucky Gov. Steve Beshear responds to  the President's address to Congress, questioning Trump's plan for the Affordable Care Act and urging him to unify American citizens.",cnn
13,A newly published video clip of Uber CEO Travis Kalanick may offer the world's first glimpse into his thinking about businesses that compete with his..,techcrunch
9,"Phil Brown says a man of Roy Hodgson's stature ""can only be a benefit to Leicester City.""",bbc-sport
3,The Chinese winter transfer window ends as Super League sides surpass the spending of their Premier League counterparts.,bbc-sport
13,"The Dow Jones Industrial Average topped 21,000 for the first time, the dollar advanced and Treasuries fell as investors grew increasingly confident global economic growth is accelerating, clearing the path for higher interest rates in America.",bloomberg
9,"Google has quietly launched a new video conferencing application called Meet by Google Hangouts, which is designed for HD video meetings. The web and mobile..",techcrunch
5,Hundreds of Coptic Christians have fled Egypt’s northern Sinai region after a spate of so-called Islamic State attacks with seven people killed within two weeks.,bbc-news
5,Saudi Arabia's king is visiting Indonesia and he's not travelling lightly.,bbc-news
6,"President Trump praises the American military and honors Carryn Owens, the widow of William ""Ryan"" Owens who was a Navy SEAL killed in a late-January raid in Yemen.",cnn
6,"CNN political commentator Van Jones said that the moment when President Donald Trump addressed Carryn Owens, the widow of slain US Navy SEAL William ""Ryan"" Owens, was a crucial moment.",cnn
3,"Before being accused in the death of Kim Jong-un’s half brother, Doan Thi Huong was one of millions of Southeast Asians living abroad in search of work.",the-new-york-times
6,Democrats call on Jeff Sessions to quit as he insists he did not mislead his confirmation hearing.,bbc-news
6,"America's top prosecutor Jeff Sessions insists his confirmation testimony was ""honest and correct"".",bbc-news
5,"Amazon's S3 web-based storage service is experiencing widespread issues, leading to service that's either partially or fully broken on websites, apps and..",techcrunch
10,"After a year of rumors, YouTube is finally drawing back the curtain on its latest play for entertainment industry domination -- a live TV service. At the..",techcrunch
6,An early glimpse at President Donald Trump's first budget proposal offers the clearest blueprint yet of how he plans to remake the nation.,cnn
9,England all-rounder Ben Stokes says he has grown up as his side prepare for a three-match ODI series against West Indies.,bbc-sport
9,"A protest in Chile to encourage forward Alexis Sanchez to leave Arsenal, which was supposed to attract 14,000, was only attended by a handful of people.",bbc-sport
13,Investor appetite for the first tech listing of the year boosted the fortunes of Evan Spiegel and Bobby Murphy.,bloomberg
15,"After star money manager Bill Gross left in 2014, Pacific Investment Management Co. seemed destined to fade from prominence and become just one of many firms that dot the U.S. bond-industry landscape. But then Dan Ivascyn, the man tapped to replace Gross, got hot.",bloomberg
13,"Spotify has surpassed 50 million subscribers, extending its lead over rivals Apple Music, SoundCloud and Google as the world’s largest paid music streaming service.",bloomberg
9,"The drivers love the new cars, and the first week of testing in Barcelona has given us a picture of who is fast and who is not, writes Andrew Benson.",bbc-sport
6,"Attorney General Jeff Sessions removed himself from investigations into Russian interference in American politics and contacts with associates of President Donald Trump, after the Justice Department acknowledged he had contacts with the Russian ambassador during the 2016 campaign.",bloomberg
13,Goldman Sachs Group Inc.’s dealmakers endured job cuts and a tough bonus season. Then the penny pinchers turned to their beloved phones.,bloomberg
5,"The U.S. Air Force has opened a review of the propulsion systems used for Lockheed Martin Corp.’s military satellites after an undisclosed problem during a recent attempt to boost one into orbit, according to the service.",bloomberg
5,"It’s been a great year for the rich, a terrible year for Uber, and did you know you can lease a dog?",bloomberg
13,"While the world’s attention has been gripped by politics in the U.S. and Europe in recent weeks, China has been quietly cementing its newfound influence on financial markets.",bloomberg
13,It’s not easy to win back customers’ trust after your product bursts into flames. But it can be done.,bloomberg
6,Rex Tillerson’s effectiveness depends on his shedding some of the instincts that led to his hire.,bloomberg
6,"Capitol Hill has been dominated Thursday by a disagreement over what, if any, steps Attorney General Jeff Sessions should take after it surfaced that he spoke with the Russian ambassador to the US during last year's campaign.",cnn
6,Top Democrats have called for US Attorney General Jeff Sessions to resign after it emerged he failed to disclose meetings with a Russian diplomat,cnn
6,"Vice President Mike Pence routinely used a private email account to conduct public business as governor of Indiana, according to reports from Indystar. CNN's John Berman reports.",cnn
6,"During the 2016 campaign, Jeff Sessions called on then-Attorney General Loretta Lynch to recuse herself from the investigation into Hillary Clinton's use of a private email server and to appoint a special prosecutor in the case.",cnn
6,President Donald Trump's senior aide Jared Kushner and ousted adviser Michael Flynn met with the Russian ambassador to the United States at a time when the Trump administration's relationship with the Russians was under close scrutiny.,cnn
6,"Kentucky Republican Sen. Rand Paul marched to the House side of the Capitol Thursday morning, knocked on a locked door and demanded to see a copy of the House's bill to repeal and replace the Affordable Care Act, which he believed was being kept under lock and key.",cnn
3,"Several US officials told CNN Thursday that the US is now taking action to locate and monitor hundreds of people or ""contacts"" found as part the intelligence retrieved during the deadly raid last month in Yemen targeting al Qaeda in the Arabian Peninsula.",cnn
6,"With every new revelation about contacts between the Trump campaign and Russians, it becomes clearer that it's  time for Congress to set up a bipartisan select committee to investigate, Julian Zelizer says.",cnn
3,"In a paper released Wednesday night, the Trump administration hinted that it may not abide by rulings from the World Trade Organization, which would be a major shift from previous presidents.",cnn
5,The actor has been named the official guest speaker for the University of Southern California’s 134th graduation ceremony on May 12.,entertainment-weekly
5,The Alpha Vampire returns to take on the British Men of Letters,entertainment-weekly
5,Archie steals a Pussycat,entertainment-weekly
5,"Tears, tributes, and too much Teddy",entertainment-weekly
4,"Beauty and the Beast doesn’t hit theaters until March 17, but right now, you can catch a glimpse of Beauty, the Beast, Gaston, and the whole fantastical crew. Below, courtesy of the film&#821…",entertainment-weekly
13,"Five new team members join the ranks of Team Adam, Team Blake, Team Alicia, and Team Gwen, but only one of them forces a judge to walk off the stage",entertainment-weekly
9,Get the latest NCAA college basketball bracketology breakdown from ESPN's Joe Lunardi,espn
5,"2 Chainz, Wiz Khalifa, Pitbull, and Camilia Cabello will also be on film’s album",entertainment-weekly
5,Moviegoers will have to wait five extra months to see Jason Statham battle a massive prehistoric shark. Warner Bros. announced Thursday that its underwater thriller Meg has been delayed until Aug. …,entertainment-weekly
9,Get a summary of the Golden State Warriors vs. Chicago Bulls basketball game,espn
4,"How do you improve on classic books? Put a Harry Potter spin on them, of course! That’s exactly what Twitter users did Thursday with the hashtag #PotterABook. Fans of literature and J.K. Rowl…",entertainment-weekly
5,"With four days of workouts about to get underway at the NFL combine, Mel Kiper and Todd McShay give out some players to watch and a few predictions.",espn
9,"In an interview with ESPN, Warriors big man Draymond Green insists the team remains focused despite the loss of Kevin Durant for an extended period.",espn
9,Stay up to speed during Championship Week as conference tourneys determine which teams earn automatic bids to the women's NCAA tournament.,espn
3,"Myles Garrett, Leonard Fournette and David Njoku are just a few of the NFL prospects expected to showcase their athleticism in Indianapolis.",espn
5,"Nintendo Switch How-To Guides - Nintendo Switch: Below is a list of tips and guides to help you get more out of your Nintendo Switch -- and solve annoying problems (for more on that, check out Prob...",ign
4,"Players like Brandon Crawford have leverage and can command top dollar at the bargaining table, but teams still score big values on these deals paying seven or eight figures.",espn
10,"Paramount has hired Kubo and the Two Strings director Travis Knight to helm the Transformers spinoff movie, Bumblebee.",ign
15,Pitchers don't visit Dr. James Andrews for the magazines in his waiting room. Are the Red Sox about to lose their $217 million man?,espn
5,A final look at both retail versions of The Legend of Zelda: Breath of the Wild.,ign
13,Hello Labs will provide support and funding to smaller developers creating experimental projects.,ign
5,Nickelodeon has announced a new 2D animated Teenage Mutant Ninja Turtles series that will feature a more mystical New York City setting.,ign
13,The Rogue One and Ip Man star has been tapped to star in an adaptation of Square Enix's Sleeping Dogs.,ign
13,Jack Sparrow's chased by a new foe from beyond a watery grave.,ign
5,"Just Dance 2017 is a fun dancing game, but it doesn't really teach you anything, and has an annoying paywall.",ign
9,The Bolivian government is officially unhappy with the country's depiction in the game.,ign
15,Katherine Keith has had to deal with more tragedy than anyone should. How she's kept going -- with Ironman competitions and elite dog-mushing races -- shows the extreme lengths she's gone to to handle the pain.,espn
13,Amiibo Functionality - The Legend of Zelda: Breath of the Wild: Nintendo has confirmed that The Legend of Zelda: Breath of the Wild will be compatible with Amiibo and support Amiibo Functionality on both the Wii U...,ign
9,"Snap, the parent company of Snapchat, had a great day in its debut on the New York Stock Exchange. After pricing the IPO at $17 per share yesterday, the..",techcrunch
3,"Snap Inc., the parent company of Snapchat, had a stellar first day in its public debut on the New York Stock Exchange, popping 44%. The..",techcrunch
13,"For the first time ever, the price of one bitcoin has surpassed the price of one ounce of gold. While today's swap can be attributed to a good day for..",techcrunch
15,"AWS took a lot of heat when its S3 storage component went down for several hours on Tuesday, and rightly so, but today they published a..",techcrunch
6,The announcement came after a day of rapid-fire developments that intensified pressure for a full investigation into Moscow’s meddling in the election.,the-new-york-times
6,"Attorney General Jeff Sessions said Thursday he will recuse himself from involvement in any probe related to the Trump campaign, after lawmakers called for him to recuse himself from an investigation into alleged Russian interference in the election.",the-wall-street-journal
6,"The president’s son-in-law and incoming national security adviser met with the ambassador, Sergey I. Kislyak, for 20 minutes at Trump Tower in December.",the-new-york-times
15,"The Iraqi military has found an obstacle course Islamic State built in an old railway tunnel near Mosul, where raw recruits crawled under barbed wire and scaled walls to begin their reshaping into seasoned fighters.",the-wall-street-journal
6,"President Donald Trump’s eldest son Donald Trump Jr. was likely paid at least $50,000 for an appearance late last year before a French think tank whose founder and wife are allies of the Russian government in efforts to end the war in Syria.",the-wall-street-journal
3,Snap shares surged 44% on their first day of trading Thursday as investors sought a piece of the biggest technology initial public offering in the U.S. since Alibaba made its debut in 2014.,the-wall-street-journal
15,"Campaign-finance records show attorney general used campaign account, not official funds, for expenses to Cleveland, where he met Russia’s ambassador at an event.",the-wall-street-journal
13,Was the first lady’s outfit on Tuesday night a slyly mischievous response to the Democratic women who came clad in all white?,the-new-york-times
15,The European Union’s parliament on Thursday asked for the bloc to scrap visa-free travel for U.S. citizens within two months in retaliation for the U.S. continuing to exclude five EU countries from its no-visa regime.,the-wall-street-journal
5,Federal agents on Thursday raided three Caterpillar facilities in Illinois in search of any evidence that the machinery giant may have released false or misleading information about its financial documents and exports.,the-wall-street-journal
6,"What he did was as bad, if not worse, than Richard Kleindienst, Nixon’s attorney general.",the-new-york-times
13,Costco Wholesale Corp. is raising membership fees—the retailer’s main profit driver—after higher costs in the latest period offset strong sales during the holiday quarter.,the-wall-street-journal
15,"A year after oil magnate Aubrey McClendon died in an auto crash, lawyers in Oklahoma City are sifting through the tangle of obligations and assets he left behind, trying to determine if he died a wealthy man—or swamped by debt.",the-wall-street-journal
13,The Alternative for Germany party is making headway with a message that an overemphasis on guilt over the Nazi era prevents national pride and hamstrings government policy.,the-wall-street-journal
6,"Sessions had been facing mounting pressure to step away from any investigations, after it was revealed he had talked to the Russian ambassador twice and not disclosed those contacts.",the-washington-post
6,At least not with the evidence at hand.,the-washington-post
6,Sessions answers one big question — and raises a bunch more.,the-washington-post
6,"Trump said he has ‘total’ faith in his attorney general, who has quickly begun implementing the president’s vision in his first weeks on the job.",the-washington-post
13,The controversy is exacerbated by Trump’s tendency to treat to personalize issues with broader implications.,the-washington-post
6,Pence's private AOL account was hacked in 2016.,the-washington-post
6,"It's too early for Pelosi to make such a sweeping statement, as the Sessions case is still unfolding.",the-washington-post
6,Attorney General Jeff Sessions met with the Russian ambassador during Trump's campaign last year. Sessions recused himself from any investigation related to the presidential campaign.,cnn
13,Attorney General Jeff Sessions had a chaotic day at the office Thursday as he faced a barrage of criticism over newly revealed contacts with Russia’s ambassador to the U.S. and eventually rec…,entertainment-weekly
10,The mass grave near the city of Mosul could be among the militants’ largest.,the-washington-post
6,The host joked that the politician could be ‘The World’s Oldest Living Boy’ at a traveling carnival,entertainment-weekly
13,The intelligence community believes Russian hacking was meant to benefit Trump's campaign. The attorney general is not so sure.,the-washington-post
3,Family advocates say state and local laws requiring reimbursement for incarceration only add to children’s struggles.,the-washington-post
15,"The UK could walk away without paying - but this might imperil a trade deal, peers say.",bbc-news
13,The Democratic Unionist Party is narrowly returned as the biggest party but Sinn Féin is the biggest winner in the NI Assembly election.,bbc-news
13,Hospital attendances for sleep disorders in under-14s in England triple in 10 years.,bbc-news
6,Daimler is recalling around one million vehicles worldwide because of the risk of fire.,bbc-news
15,The studio was being used by the BBC News channel but the intruders were not seen on air.,bbc-news
3,A man suspected of involvement in Kim Jong-nam's death says he is the victim of a conspiracy.,bbc-news
5,Councils and fire authorities are calling for the limit to be lowered in line with Scotland.,bbc-news
6,Councils in the capital will hand over hundreds of millions more to top up other local authorities.,bbc-news
13,"It has the ""worst view in the world"", the artist says, as it is next to Israel's controversial wall.",bbc-news
13,"Households face largest rise in a decade on back of social care costs, say public finance experts.",bbc-news
10,Rory McIlroy cards a stunning six-under-par 65 to take the lead at the halfway stage of the World Golf Championships event in Mexico.,bbc-sport
9,Andy Murray beats France's Lucas Pouille in straight sets to reach the final of the Dubai Championships for the second time.,bbc-sport
9,A century from England captain Eoin Morgan sets up a 45-run win over West Indies in the first one-day international in Antigua.,bbc-sport
9,"Tony Bellew has been ""underestimated"" before his heavyweight fight with David Haye, says ex-world champion Richie Woodhall.",bbc-sport
15,Briton Andrew Pozzi wins gold in the 60m hurdles at the European Indoor Athletics Championships in Belgrade.,bbc-sport
4,Chris Wood scores twice as Leeds move to within a point of third place in the Championship after winning at Birmingham.,bbc-sport
3,Exeter Chiefs move one point behind Premiership leaders Wasps with a hard-fought bonus-point win at Leicester Tigers.,bbc-sport
6,Eilidh Doyle misses out but Laviai Nielsen qualifies for the 400m final at the European Indoor Athletics Championships in Belgrade.,bbc-sport
6,The chief executive of UK Sport says she will apologise to anyone who believes the agency is partly to blame for failings at British Cycling.,bbc-sport
6,Manchester United boss Jose Mourinho says he is not the monster he was once portrayed as.,bbc-sport
15,The TSA reacts to a study that found weapons making it past security.,bloomberg
9,"Federal Reserve Chair Janet Yellen left little doubt on Friday that the central bank will raise interest rates this month. More importantly, she dropped hints that it might end up having to increase them this year more than planned.",bloomberg
3,Tesla Inc. is losing key personnel as it races to bring the Model 3 -- its most critical electric sedan yet -- to market later this year.,bloomberg
15,An Uber Technologies Inc. program used to counteract government officials attempting to conduct “sting” operations is drawing scrutiny amid a flurry of scandals plaguing the ride-hailing company.,bloomberg
6,The White House says reform of controversial guest worker program 'is an issue we are closely and carefully looking at',bloomberg
15,New York (AP) -- Arnold Schwarzenegger said Friday that he's through with,bloomberg
15,"As the Trump administration sets to work gutting environmental regulations, the best weapon for battling climate change in the U.S. may be jobs.",bloomberg
5,"Venezuela tops the list once again, but it's the moves in the middle that matter",bloomberg
15,A woman reapplying for legal status is now detained. Her arrest came moments after she gave an immigration speech. CNN's Nick Valencia reports.,cnn
6,"Republican Sen. Lindsey Graham said what President Trump is doing with his immigration plan is a good thing because he is getting the ""bad hombres"" out.",cnn
6,"Carter Page, the man once linked to then-candidate Donald Trump's foreign policy team, talks with CNN's Anderson Cooper about his relationship to the campaign.",cnn
6,Senate Judiciary Committee Chairman Chuck Grassley on Friday denied calls by his Democratic colleagues to bring Attorney General Jeff Sessions before the panel in the coming days to testify about his meetings with the Russian ambassador.,cnn
13,"If there’s one lesson Silicon Valley can learn from Snap Inc.’s trading debut, it’s that investors in initial public offerings are again willing to stomach the uncertainty of betting on hopeful, young companies.",bloomberg
15,"Romulo Avelica-Gonzalez, an undocumented immigrant from Mexico, was arrested near a Los Angeles school one of his daughters attends. The daughter wept as immigration agents took her handcuffed father away in a black car.",cnn
15,"A recent Department of Homeland Security intelligence assessment found that most foreign-born violent extremists do not arrive in the US radicalized, but become radicalized after living in the US for several years.",cnn
6,Can an undocumented immigrant get kicked out of the United States without a court hearing? That's a key question at the heart of a controversial case that's become the latest lightning rod in the debate over the Trump administration's crackdown on illegal immigration.,cnn
13,"Beginning Feb. 17, vote for your favorites each week below and listen to EW Morning Live (8 a.m-10 a.m.) on Sirius XM Radio channel 105 all month to hear the songs — and the heated debate. The winn…",entertainment-weekly
15,"President Donald Trump slammed Senate Minority Leader Chuck Schumer in a tweet on Friday, accusing him of having a relationship with Russian President Vladimir Putin and presenting a photo of the two leaders as evidence.",cnn
15,The science is clear: Shared experiences are more valuable than shared consumption. Here are eight enlightening ways to turn your bonus into a trip that lasts a lifetime.,bloomberg
6,"The Department of Homeland Security is considering a proposal to separate children from adults when they are trying to enter the country illegally at the southern border, a senior DHS official confirmed to CNN on Friday.",cnn
13,"There’s a world in which it’s easily fathomable that Dustin Lance Black could be the most furious person in the country today. Given All That’s Going On In America™, beneath an administration that’…",entertainment-weekly
6,And the ‘Late Show’ host does it with the perfect ‘Star Wars’ analogy,entertainment-weekly
15,"At the world premiere of ‘Beauty and the Beast’ Thursday in Hollywood, Gad opened up about tackling the role of LeFou, whose relationship with the film’s villain Gaston has a new spin i…",entertainment-weekly
3,"This article originally appeared on PEOPLE.com. That’s a wrap! To document the last day of shooting Modern Family‘s season 8, star Sofia Vergara shared some behind-the-scenes cast photos of her “fa…",entertainment-weekly
13,"Caroline and Stefan get married, but there’s more than one surprise guest in Mystic Falls",entertainment-weekly
13,"Every week, Emerald City executive producers David Schulner and Shaun Cassidy will bring EW behind the scenes and explain the ins-and-outs of the new NBC dark fantasy series inspired by the Land of…",entertainment-weekly
5,Now is the time for true equality,entertainment-weekly
13,"Mary’s putting out fires, literal and otherwise.",entertainment-weekly
6,"Plus, Kellyanne Conway and Couchgate, and Attorney General Jess Sessions make their way into the musical montage",entertainment-weekly
