3,"If you’re already getting ready for Brendan Reichs’ upcoming Nemesis & Friends tour, here’s a little something extra to help you get ready: an exclusive excerpt from the upcom…",entertainment-weekly
3,"For those who loved Marie Lu’s bestselling debut Legend trilogy and her follow-up series The Young Elites, the wait for the celebrated writer’s next book is almost over. Dubbed as a cro…",entertainment-weekly
15,Square Enix takes a look back at every mainline game in the RPG series.,ign
15,Berserk gorilla sim Ape Out's action-packed playable trailer lets you take part in the rampage.,ign
3,Frank Cifaldi of the Video Game History Foundation drops by to show Brian a long lost Legend of Zelda game that came out on a very rare system.,ign
4,Get a summary of the Miami Hurricanes vs. North Carolina Tar Heels basketball game,espn
3,Adding free-agent CB Stephon Gilmore means Logan Ryan likely won't be back and it could affect New England's long-term plans for Malcolm Butler.,espn
6,Bulkhead Interactive's got itself a partner to put out its Kickstarted skill-based shooter.,ign
15,"We take a drive in the Nomad, Mass Effect Andromeda's new vehicle used for planetary exploration.",ign
10,Toby Kebbell and Jason Mitchell also talk up filming their big monster battle scenes.,ign
3,"Turns out, three of the most incredible Zelda cosplays we've ever seen are all from the same cosplayer.",ign
15,Tony Romo would face tough competition and high expectations if he signed with the Broncos. Don't expect him to shrink from the challenge.,espn
15,"This week on IGN's video game talk show: Nintendo Switch, Zelda, Middle-earth: Shadow of War, and more.",ign
3,"Wonder Woman, Supergirl, Batgirl, Poison Ivy, Harley Quinn, Bumblebee and Katana square off against Korugar Academy in the Intergalactic Games. Available on Digital HD on May 9 and on DVD on May 23.",ign
4,"After the vacation marketplace Airbnb last year filed SEC forms raising $555.5 million, today the company filed a new form D that has closed off its Series..",techcrunch
5,"20% off Breath of the Wild amiibo, New Mass Effect: Andromeda Limited Edition Loot Crate, and More",ign
15,"Facebook is globally launching Messenger Day to put a utilitarian spin on the slideshow format. While Snapchat Stories is for retelling what you've done,..",techcrunch
3,China's Uber rival Didi Chuxing has officially opened its U.S.-based research lab. The new center is part of a move to suck up talent beyond Didi's current..,techcrunch
3,"A few years ago, I launched a daily email newsletter, and I was ecstatic to be striking out on my own for the first time. Alas, just a few weeks after filing..",techcrunch
5,The president’s apologists are embarrassing.,the-new-york-times
6,The limestone arch on Gozo Island was well-known to travelers and fans of “Game of Thrones.”,the-new-york-times
3,"When House leaders finally unveiled their plan, the suffering it would inflict on millions of Americans was clear.",the-new-york-times
15,"AIG said Chief Executive Peter Hancock will resign after two years at the helm of the giant insurance conglomerate, following a major setback in its turnaround plan.",the-wall-street-journal
4,"Dr. Carlo Croce was repeatedly cleared by Ohio State University, which reaped millions from his grants. Now, he faces new whistle-blower accusations.",the-new-york-times
3,"Republicans in Congress scored a victory early Thursday, pushing a measure through a House committee to repeal tax penalties on Americans who don’t obtain insurance. But opposition to the health overhaul remains strong.",the-wall-street-journal
15,WikiLeaks founder Julian Assange said his group will work with technology companies to help defend them against the Central Intelligence Agency’s hacking tools.,the-wall-street-journal
3,Oil prices extended losses to hit a three-month low after a higher-than-expected buildup in U.S. crude inventories raised doubts over whether OPEC cuts will be enough to sap brimming stores of oil around the world.,the-wall-street-journal
3,"As the Syrian conflict enters its sixth year, the outcome of the scramble for Raqqa, Islamic State’s de facto capital, will shape the balance of power in the Middle East for the foreseeable future.",the-wall-street-journal
3,"Corporate executives are buying their own firms’ shares at the slowest pace in at least 29 years, the latest sign of uncertainty as the booming U.S. stock bull market this week enters its ninth year.",the-wall-street-journal
3,"Diners are footing the bill for rising minimum wages. Rather than raising menu prices, many restaurants in states including California, Colorado and New York are adding surcharges of 3% to 4% that they say are needed to offset rising labor costs.",the-wall-street-journal
3,"U.S. household net worth climbed to a record $92.8 trillion in the fourth quarter of 2016, as the end-of-year surge in stocks and a steady climb in home prices added more than $2 trillion of wealth to household balance sheets.",the-wall-street-journal
3,"In its “Infrastructure Report Card” issued every four years, the American Society of Civil Engineers forecast that it would cost about $4.590 trillion over the next decade to bring U.S. roads, bridges, public schools and ports up to a safe, functioning level.",the-wall-street-journal
3,"Investors are facing a real dilemma: chase the returns a final blowout would bring in the stock market, or switch to cash now to survive the bear market that might follow?",the-wall-street-journal
3,"The demonstration on Wednesday, in which women skipped work, wore red and refused to spend money, drew far smaller crowds than the Women’s Marches in January.",the-new-york-times
4,Nike’s new designs have produced impressive results in international races. But they have spurred another debate about what constitutes an unfair edge.,the-new-york-times
15,Critics say the plan’s effects should be evaluated first by the Congressional Budget Office.,the-washington-post
6,Move would drop Housing and Urban Development funding by about 14 percent as part of plan to cut domestic spending and increase the defense budget.,the-washington-post
2,Among many other places.,the-washington-post
4,The files provide a map of the cyber divisions and branches that have multiplied across the spy service.,the-washington-post
5,Libre by Nexus helps bail out undocumented immigrants in detention centers — for a price. The business faces lawsuits and allegations of fraud.,the-washington-post
4,"""Um, no.""",the-washington-post
15,The annual report by civil engineers gives the nation’s infrastructure a D+ and sees little progress in the past four years.,the-washington-post
3,"Theresa May defends tax increase for self-employed workers - saying it will make things ""fairer"".",bbc-news
15,"Schumer uses slippery language that implies that women get mammograms at Planned Parenthood clinics, and exaggerates the number of women who get mammogram referrals there.",the-washington-post
15,"Washington, Massachusetts and New York join Hawaii in legal challenges to Mr Trump’s travel ban.",bbc-news
15,"Passengers affected include shadow chancellor John McDonnell, who has pulled out of Question Time.",bbc-news
15,Five people are injured in the attack at Duesseldorf's main railway station.,bbc-news
15,"Boris Johnson tells the BBC that Britain should reject any EU demands for a £50bn ""exit bill"".",bbc-news
5,"Police have been questioning a man, 79, over Elsie Frost's killing after arresting him a second time.",bbc-news
3,"Ann-Marie James was stabbed in the chest by her brother Melvin, police say.",bbc-news
15,We revisit Nemley Junior who was freed from wildlife traffickers in Ivory Coast after a BBC News investigation.,bbc-news
15,Manchester City keeper Joe Hart - on a season-long loan at Torino - says he does not see himself playing for the Premier League club again.,bbc-sport
9,Alex Hales and Joe Root hit centuries as England steamroller West Indies by 186 runs in Barbados to complete an ODI series whitewash.,bbc-sport
15,Manchester United are held to a draw by FC Rostov in the first leg of their Europa League last-16 tie in Russia.,bbc-sport
3,The art of sucking up,the-washington-post
4,Liam Marshall scores four tries as Super League champions Wigan pile more misery on 2016 Grand Final opponents Warrington.,bbc-sport
15,"Before he lost the confidence of big-name investors and his company’s board members, Peter Hancock squandered the faith of many of his staff.",bloomberg
10,Wales v Ireland in Cardiff kicks off round four of the 2017 Six Nations while England host Scotland on Saturday.,bbc-sport
15,"There’s a rebellion against reflation brewing in financial markets, with many Trump trades having a, um, crude awakening this week.",bloomberg
4,Mercedes' Lewis Hamilton says Ferrari are bluffing over how fast they can go after Sebastian Vettel sets the fastest lap of winter testing.,bbc-sport
15,Chinese policy makers made it clear this week that they don’t want any surprises when it comes to the yuan.,bloomberg
3,The Washington state attorney general who stymied President Donald Trump’s original travel ban is doubling down for a new battle over the revised order issued three days ago.,bloomberg
6,"Juneau has no plan, little money for erosion or thawing permafrost.",bloomberg
5,"U.S. stocks keep on booming, but they may not deliver the long-term returns many hope for.",bloomberg
3,"Washington state will ask a federal judge Thursday to block President Donald Trump's new travel ban, joining Hawaii as the second state to challenge the executive order.",cnn
3,"During an interview with Politico, Senate Majority Leader Mitch McConnell said he does not think Mexico will pay for President Trump's proposed border wall.",cnn
15,CNN's Ben Wedeman explains the one thing you need to know about US President Donald Trump's changed travel ban.,cnn
3,"In the case of children who are known to be accompanied by their parents or guardians, it's hard to make an argument for any separation, but it has been done before, Danny Cevallos says",cnn
3,"Illegal Southwest border crossings were down 40% last month, according to just released Customs and Border Protection numbers -- a sign that President Donald Trump's hardline rhetoric and policies on immigration may be having a deterrent effect.",cnn
5,The Office of Government Ethics isn't happy with how the White House handled Kellyanne Conway's endorsement of Ivanka Trump's product line.,cnn
3,"During the White House briefing, Press Secretary Sean Spicer told reporters President Trump believes systems at the CIA need to be updated and that the US position on WikiLeaks founder Julian Assange has not changed.",cnn
6,"FBI Director James Comey spent Thursday afternoon on Capitol Hill meeting with the eight lawmakers who have access to the most highly classified information, sources told CNN.",cnn
15,“It was embedded into our head to sip drank.”,bloomberg
4,"Freeform’s newest original series Famous in Love will enjoy a binge launch when the series premieres in April, following the debut of Pretty Little Liars’ final season. Viewers will be …",entertainment-weekly
3,"Burning Sands sounds like it should be set on some scorched Middle Eastern battlefield, but the stark indie drama is about another kind of violence—and not one much less harrowing: fraternity hazin…",entertainment-weekly
10,"Hollywood’s largest primate goes head-to-head with the industry’s reigning comic book mutant this weekend, as Kong: Skull Island launches into theaters as Fox’s X-Men spinoff Loga…",entertainment-weekly
15,The head of the Environmental Protection Agency administrator said Thursday he does not believe that carbon dioxide is a primary contributor to global warming -- a stance at odds with leading climate scientists.,cnn
3,"The Atlanta cast continues to take over Hollywood. The Deadpool sequel has found its Domino in Atlanta star Zazie Beetz. Ryan Reynolds made the announcement Thursday on Twitter, spelling the actres…",entertainment-weekly
3,"Of all the accounts of Barack Obama’s historic victory in the 2008 presidential election, few were as entertaining as Mark Halperin and John Heilemann’s Game Change. The veteran politic…",entertainment-weekly
3,"Eight years after introducing moviegoers to the exotic alien world of Pandora in Avatar, James Cameron is inviting them to experience it in the flesh. On Thursday’s episode of The View, Camer…",entertainment-weekly
15,"In the movie Fist Fight, teacher Ron Strickland (played by Ice Cube) challenges his colleague, Andy Campbell (Charlie Day), to a fist fight when Campbell gets him fired. Ice Cube was able to draw f…",entertainment-weekly
3,"If you are looking for a darkly entertaining crime thriller then you could do much worse than check out E.L. Katz’s 2013 directorial debut, Cheap Thrills. And, judging by its trailer, we look…",entertainment-weekly
3,"The Browns had the cap room to do the Texans a favor by taking Brock Osweiler off their hands, but Cleveland fans shouldn't get too attached.",espn
6,The Linked Together duo tours the shrines of The Great Plateau with the goal of getting off this rock and exploring Hyrule proper.,ign
3,"The Texans are a QB away from being dominant, and thanks to a lifeline thrown to them by Cleveland, they have a chance to hit the reset button.",espn
15,"Jay Cutler was supposed to make Chicago a perennial contender. Though the QB rewrote the team's record book, he led them to the playoffs just once.",espn
4,Before Fred Armisen and Carrie Brownstein’s IFC sketch series Portlandia wraps up its seventh season tonight at 10 p.m. ET/PT — and ends its entire run next year — let’s get a bird&#821…,entertainment-weekly
3,Make money in The Legend of Zelda Breath of the Wild very fast with this incredibly easy method. Using this method can net you about 10K rupees an hour.,ign
15,Steven Universe co-creator Rebecca Sugar has written an original story for the upcoming RPG.,ign
15,Winter is coming in just a few months.,ign
15,Now you too can own a fully functioning slice of Mass Effect Andromeda to explore the foreign terrain of your living room and backyard.,ign
15,Amadeus Cho and the X-Men are teaming up to battle a creature with the combined powers of Wolverine and the Hulk.,ign
15,Batman Returns' Danny DeVito has reunited with Tim Burton for the upcoming live-action Dumbo remake.,ign
15,"Headsets need to both sound and feel good, and Corsair's VOID RGB (mostly) fits the bill.",ign
15,"One of the main stars of It's Always Sunny in Philadelphia, Glenn Howerton, might not be coming back for Season 13.",ign
15,An original story that takes a break from the well-worn VR premise to explore augmented reality.,ign
4,"Google's messaging strategy can be confusing, but if there's one thing that's clear after today's Cloud Next keynote, it's that the company is doubling down..",techcrunch
3,"Republicans in Congress scored a victory Thursday, pushing measures through two House committees to replace parts of the Affordable Care Act. But opposition to the health overhaul remains strong.",the-wall-street-journal
4,"This is a pivotal week for Google Cloud Platform. As it hosts its annual Google Cloud Next Conference in San Francisco, it will offer the usual lineup of..",techcrunch
3,U.S. oil prices fell below $50 a barrel for the first time in three months after data showing rising U.S. stockpiles forced traders out of bets on the end of a long-standing glut.,the-wall-street-journal
3,"WikiLeaks founder Julian Assange pledged to share with technology companies technical details of the purported Central Intelligence Agency hacking tools his organization revealed this week.The CIA lashed out against WikiLeaks, saying Assange is “not exactly a bastion of truth and integrity.”",the-wall-street-journal
3,"U.S. hopes of capturing Islamic State’s Syrian stronghold of Raqqa have become entangled in an intense debate over the offensive that is threatening to delay key decisions for weeks, according to U.S. officials.",the-wall-street-journal
4,"In its quest to prove Airbnb is more than a casual home-sharing service, the hotel industry has issued a stinging analysis of the website that casts the company more like a professional short-term rental operation.",the-wall-street-journal
3,"The state of Washington, which played a central legal role in derailing President Donald Trump’s original executive order on immigration, will challenge the new White House order, its attorney general said.",the-wall-street-journal
15,Americans now officially drink more bottled water than soda. It’s a shift that decades ago might have seemed unthinkable—that consumers would buy a packaged version of something that was free from a tap.,the-wall-street-journal
15,"As he’s done all his life, Donald Trump sold those around him a bill of goods.",the-new-york-times
3,"The statement reinforced a conundrum: Either the president’s assertions that President Barack Obama wiretapped him are baseless, or he may have implicated himself in a government investigation.",the-new-york-times
3,"Prime Minister Narendra Modi has emerged as India’s most powerful leader in a generation, but his forceful leadership style is facing a major test in local elections. He is changing the way the country is governed, keeping cabinet ministers on a tight leash and micromanaging the stubbornly independent bureaucracy.",the-wall-street-journal
15,"Republican leaders are pressing ahead as opposition grows among industry groups, liberals and conservatives.",the-washington-post
15,"'I would not agree that it's a primary contributor to the global warming that we see,' Pruitt said of human-caused pollution.",the-washington-post
15,Julian Assange said the group had “decided to work with” companies so that flaws could be fixed.,the-washington-post
15,"The matter will again be in the hands of Judge James L. Robart, who first suspended Trump’s controversial executive order.",the-washington-post
12,One arrest has been made.,the-washington-post
15,"The plot thickens! Once Upon a Time has tapped Alison Fernandez for a mysterious role in the upcoming season 6 finale, EW has learned exclusively. The actress, who played a younger version of the t…",entertainment-weekly
15,"Rep. Roger Marshall, a physician, responded to criticism of his health-care views in a statement Thursday.",the-washington-post
5,Why Republican Sen. Tom Cotton's criticism of the health bill matters plenty.,the-washington-post
15,"After 30 years, the collector who wouldn’t back down is trying to give away his art.",the-washington-post
6,"The lawsuits name McKesson, Cardinal Health. AmerisourceBergen, Walgreens, CVS and others.",the-washington-post
15,"Kenneth Hugill had been ""petrified"" he was going to die but said had not intended to hurt anyone.",bbc-news
15,"Thor: Ragnarok was inspired by the Planet Hulk comics arc, Asgardian staples Hela and Valkyrie, the Norse end of the world myth, and much more.",ign
3,"The ""tax raid"" on the self-employed in the Budget will be seen as a ""rookie error"", a former chancellor says.",bbc-news
15,"Food blogger Jack Monroe wins £24,000 damages in a libel action against columnist Katie Hopkins.",bbc-news
15,The family of the Penge crash victims said they were disappointed at the length of the sentence handed out.,bbc-news
3,An interview with an expert on South Korea had some uninvited guests steal the limelight.,bbc-news
15,"Track cyclist Jess Varnish says she is ""relieved that the truth was finally coming out"" following allegations of sexism at British Cycling.",bbc-news
15,Judge Lindsey Kushner used her final case to urge women to protect themselves from predatory men.,bbc-news
15,Wales survive an Ireland fightback to claim victory and hand England the chance to clinch the Six Nations title against Scotland on Saturday.,bbc-news
3,"The instructor called the prisoner ""darling"" and he sent her ""crude references"", a court hears.",bbc-news
9,"British number one Johanna Konta beats compatriot Heather Watson to reach the third round in Indian Wells, while Kyle Edmund wins.",bbc-sport
15,Chris and Gabby Adcock fight back to defeat the Olympic champions and reach the All England Badminton semi-finals.,bbc-sport
10,Brighton comfortably beat out-of-form Derby to move level on points with Championship leaders Newcastle.,bbc-sport
15,"Abuse victim Michael Kelsick, who died before the end of the trial, made British courtroom history.",bbc-news
15,Liam Sutcliffe guides Leeds Rhinos to a convincing victory against previously unbeaten Catalans Dragons at Headingley.,bbc-sport
15,"Stuart Hogg says Scotland are ""not a team that lies down"" as they target a first win over England at Twickenham in 34 years.",bbc-sport
15,"England's powerful finishers have helped them to a 17-match winning run - so what's the problem at the start of the match, asks Tom Forydce.",bbc-sport
15,"John Surtees - the teenage prodigy, the world champion on two and four wheels and a ""warm character who was generous with his time"".",bbc-sport
10,"Beating non-league Lincoln City in the FA Cup will not be as easy for Arsenal as it seems, says Match of the Day pundit Neil Lennon.",bbc-sport
15,Houston hosted two events this week: the nation’s largest energy conference and the town’s famous rodeo. They have more in common than you’d think.,bloomberg
3,"Washington (AP) -- Attorney General Jeff Sessions is seeking the resignations of 46 United States attorneys who were appointed during prior presidential administrations, the Justice Department said Friday.",bloomberg
3,"Bitcoin’s price plummeted after U.S. regulators rejected a proposal by the Winklevoss twins for a publicly traded fund based on the digital currency, dashing hopes that a government-approved investment vehicle would lead to wider interest in virtual money.",bloomberg
3,The Texas senator is unhappy with what many conservatives consider a half-baked repeal-and-replace effort racing through the House.,bloomberg
6,"Almost six million returns are missing, and there’s only five weeks left. What’s going on?",bloomberg
3,"Despite the U.S. government’s steps to tackle cybersecurity threats, hackers continue to target federal agencies and they experienced tens of thousands of incidents last year, according to a White House report.",bloomberg
3,German developer PNE Wind AG and Norway’s Statoil ASA are asking the U.S. government to open additional sites for offshore wind farms off the coasts of New York and Massachusetts.,bloomberg
15,Two economists say post-election confidence stimulated hiring. A third says it’s just the weather.,bloomberg
15,Fewer Americans are taking the LSAT. Demand for the GRE is booming. Harvard did the math.,bloomberg
15,California relaxed several rules on self-driving cars as the state tries to maintain its status as a leading test bed for the future of transportation.,bloomberg
5,"Daniela Vargas, who was detained by US immigration agents after she publicly criticized Immigration and Customs Enforcement raids, was released Friday.",cnn
3,"Los Angeles officials say they want ICE officers to stop calling themselves ""police."" When ICE officers do so, the officials say, it endangers public safety. ICE says it's a term that can mean life or death in dangerous situations.",cnn
15,Francisca Lino has been checking in with Immigration and Customs Enforcement (ICE) for 12 years but this is her first time reporting since Donald Trump became President. CNN's Rosa Flores reports.,cnn
3,"Asked whether a ""deep state"" of entrenched government employees exists, White House press secretary Sean Spicer said Friday that some federal employees were working to advance the previous administration's agenda.",cnn
3,"During the White House press briefing, Press Secretary Sean Spicer claims he is ""not aware"" over and over again when questioned about the Justice Department's investigation into President Donald Trump's wiretapping claim.",cnn
3,The Trump administration quietly made it more difficult for immigrants to seek asylum in the US last month,cnn
3,"Trump administration mulling plan that would separate mothers from children to deter asylum seekers, says Raul Reyes, a cruel, costly approach that would  do nothing to stop those fleeing violence.",cnn
6,"Attorney General Jeff Sessions has asked for the resignations of 46 US attorneys, the Justice Department announced Friday.",cnn
3,"Margaret Atwood is speaking out about the political relevance of her book The Handmaid’s Tale in the era of Donald Trump’s presidency. Her 1985 novel, which has been adapted into a seri…",entertainment-weekly
3,"Somewhere in the halls of the J. Edgar Hoover building in Washington, a closely held number of FBI agents face the daunting task of determining how the Russian government sought to manipulate the US presidential election.",cnn
3,"If you’re a music legend who hasn’t been photographed by Mick Rock then you may not be as legendary as you think. Now, a new documentary called Shot! The Psycho-Spiritual Mantra of Rock…",entertainment-weekly
4,"Disney’s new live-action Beauty and the Beast may not hit theaters until March 17, but for the last week, discussion has been swirling around the fact that the film features a gay character. Now, E…",entertainment-weekly
3,"The day has finally come to say goodbye to Mystic Falls, the Salvatore brothers, and eight seasons worth of shocking twists as The Vampire Diaries airs its series finale. And to honor the show that…",entertainment-weekly
3,"Emma Watson, who is headlining the upcoming Beauty and the Beast, was originally eyed for another musical. A few weeks after Emma Stone won an Oscar for La La Land, Watson is opening up on why…",entertainment-weekly
