3,"Premier Li Keqiang mapped out a cautious economic course for China, setting a modest downshift in growth to let the government rein in swelling financial risks and ensure a smooth changeover in the political leadership this year.",the-wall-street-journal
3,"Women seem to have a thing for white wine, with many drinking it almost exclusively. What’s at the root of this love connection? Wall Street Journal wine columnist Lettie Teague explores.",the-wall-street-journal
15,"Long a sleepy city that drew Hollywood stars, this desert oasis is grappling with a surge in short-term home rentals.",the-new-york-times
15,Saturday Night Live also recruited host Octavia Spencer for the sketch about the attorney general's rough week.,the-washington-post
15,"Thirteen potential UK terror attacks have been prevented in less than four years, police reveal.",bbc-news
13,"Several projectiles flew about 1,000km (620 miles) and three fell into Japanese waters.",bbc-news
15,"WHO chief says air pollution is linked to 600,000 deaths in children under five.",bbc-news
3,"Tennessee guard Diamond DeShields, 21, is the daughter of a former Major League Baseball player, Delino DeShields, and the sister of a current one, Texas Rangers outfielder Delino DeShields Jr. But…",espn
15,"The illegal Colombian coca crop has exploded since 2013, and a State Dept. report says U.S. cocaine use is on the rise for the first time in nearly a decade.",the-washington-post
15,My reason — it may have been harming my mental health — wasn’t something to share.,the-washington-post
3,"A mother tells BBC's Crimewatch she wanted ""to die there and then"" after being struck by a car.",bbc-news
15,"The body of Lea Adri-Soejoko, 80, was found in a lock-up at a north-west London allotment on Tuesday.",bbc-news
6,Communist Party delegates gathering in Beijing give their views on US President Donald Trump.,bbc-news
13,The party says Jeremy Corbyn did include his leadership salary in his tax return.,bbc-news
13,Thousands of troops secure the biggest game involving foreign players since 2009.,bbc-news
6,Police say Tristan Voorspuy was killed by pastoral herders while inspecting a fire-damaged lodge.,bbc-news
15,"The FBI chief has rejected President Trump's claim that Barack Obama tapped his phone, reports say.",bbc-news
10,"Manchester City boss Pep Guardiola says Premier League leaders Chelsea are ""almost unstoppable"" in the title race.",bbc-sport
9,"Arsenal forward Alexis Sanchez had an angry exchange with team-mates before Saturday's defeat at Liverpool, for which he was dropped.",bbc-sport
3,BBC Sport looks back at a busy weekend for Premier League referees Anthony Taylor and Kevin Friend after they were involved in incident-packed games following their return from a mid-week trip to Marbella for Taylor's stag do.,bbc-sport
15,Joe Root and Chris Woakes guide England to a four-wicket win and a series-clinching victory over West Indies.,bbc-sport
15,"Britain's Laura Muir wins the 3,000m to gain her second gold as Asha Philip takes the 60m title at the European Indoor Championships.",bbc-sport
13,Billy Vunipola is recalled to the England squad for the Six Nations match against Scotland after returning from injury.,bbc-sport
15,World number one Dustin Johnson of the US beats England's Tommy Fleetwood to win the World Golf Championships in Mexico.,bbc-sport
4,A Russian politician proposes legalising football hooliganism and turning it into a sport.,bbc-sport
10,In-form Harry Kane scores twice as Tottenham defeat Everton to close the gap on leaders Chelsea to seven points.,bbc-sport
15,"A deadly form of bird flu has been confirmed in a southern Tennessee chicken flock, marking the first U.S. case at a commercial poultry farm this year.",bloomberg
3,"Japan moved to the highest possible alert level after North Korea fired four ballistic missiles simultaneously into nearby waters, the latest provocation from Kim Jong Un’s regime.",bloomberg
4,"Tottenham's win over Everton demonstrates how big a part Dele Alli plays in Harry Kane's success, says MOTD2 pundit Jermaine Jenas",bbc-sport
3,South Korea’s special prosecutor accused Jay Y. Lee and other Samsung Group executives of conspiring to create fake documents to mask millions of dollars in bribes funneled to a confidante of the nation’s president.,bloomberg
3,"Former Director of National Intelligence James Clapper said there was no wiretap activity directed against President Donald Trump or his campaign by the Obama administration, as Trump has claimed without evidence in calling for a Congressional investigation.",bloomberg
5,The professionals are at the bureau. Lawmakers should stick to oversight.,bloomberg
4,Deutsche Bank AG Chief Executive Officer John Cryan tore up his own turnaround plan in an admission that the 17-month-old effort flopped.,bloomberg
15,Venture capital is just the start.,bloomberg
15,Francois Fillon is fighting to stay in the French presidential race by appealing to his base as his support among party leaders slips away amid a corruption scandal.,bloomberg
3,"The FBI asked the Justice Department on Saturday to refute President Donald Trump's assertion that President Barack Obama ordered the wiretapping of Trump's phones last year, two sources with knowledge of the situation told CNN.",cnn
15,The revolution in the U.S. Treasury market is in limbo.,bloomberg
3,"President Donald Trump is extremely frustrated with his senior staff and communications team for allowing the firestorm surrounding Attorney General Jeff Sessions to steal his thunder in the wake of his address to Congress, sources tell CNN.",cnn
3,So much for the winter blues. It’s been so balmy across part of the U.S. that Americans have been firing up their grills at a time that’s usually better suited to sipping hot cocoa.,bloomberg
3,"The mystery over Donald Trump and Russia is taking a corrosive hold on his presidency, sowing accusations and hysteria that threaten to overwhelm his White House and drain his personal credibility.",cnn
6,President Trump's deputy press secretary defended Trump's unsubstantiated claim that President Obama wiretapped his phones at Trump Tower ahead of the 2016 election.,cnn
3,"Sen. Marco Rubio said Sunday that whether or not President Donald Trump's unsubstantiated assertions that President Barack Obama wiretapped his phones at Trump Tower during the presidential election are true will become clear ""very quickly.""",cnn
3,"President Donald Trump is asking Congress to look into whether the Obama administration abused its investigative powers during the 2016 election, White House press secretary Sean Spicer said in a statement Sunday.",cnn
3,Rep. Cedric Richmond apologized to White House adviser Kellyanne Conway on Sunday night for making crude remarks at a Washington dinner last week about a photo showing Conway on her knees on an Oval Office sofa.,cnn
3,These legends are trying to play nice. It’ll never last.,entertainment-weekly
15,It’s a bad day for Hannah and Ray,entertainment-weekly
15,"The Walking Dead director Greg Nicotero told us all about the crazy zombie carnival from hell episode that just aired on AMC, but we already have our first look at next week’s episode — and if this…",entertainment-weekly
6,A game of Texas Hold ‘Em brings out the best and worst of Bobby Axelrod,entertainment-weekly
16,H.G. Wells must stop Jack the Ripper… in 2017,entertainment-weekly
15,The former ‘Late Show’ host says he would have ‘gone to work on Trump’,entertainment-weekly
15,Rick and Michonne’s honeymoon excursion to find more guns gets upended,entertainment-weekly
3,"SPOILER ALERT: Read on only if you have already watched Sunday’s episode of The Walking Dead, “Say Yes.” Everyone loves a carnival — unless the rides make you sick. Or unless there are military zom…",entertainment-weekly
3,"With the playoffs likely out of reach, all that's left to watch for is how the Knicks' younger players grow. And on Sunday, that wasn't a bad thing.",espn
15,"With Stephen Curry thawing out a cold shooting hand, the Warriors ended their post-Durant injury stumbles with a win in New York.",espn
4,Danny Acosta scored the winning goal in a penalty shootout as the United States beat Honduras to win the CONCACAF U20 Championship in Costa Rica.,espn
15,"Isaiah Thomas and Tyler Ulis have a bond as two small guards. On Sunday, a Thomas turnover opened the door for Ulis' buzzer-beater to beat the Celtics.",espn
3,"The New York Red Bulls ground out a gritty win against expansion Atlanta United, a team the rest of the league would be wise not to take lightly.",espn
15,"Looking for a reason to get excited about the WBC? Among several star-spangled rosters, Team USA could finally win it all.",espn
15,One of Black Sails' stars discuses this week's huge turning point episode and the significance of their scenes.,ign
4,Captain Flint and John Silver scramble as Spain invades and sends the island into chaos.,ign
15,Rick and Michonne search for guns while Rosita makes a big decision back on Alexandria.,ign
10,"Updated with the results of Kevin Owens vs. Goldberg, Bayley vs. Charlotte, Roman Reigns vs. Braun Strowman, and more.",ign
3,The third episode of the all-star HBO series was the best one so far.,ign
6,Danny Rand isn't quite ready to wear the yellow and green outfit.,ign
15,Those planning to customize their console with adhesives may want to reconsider.,ign
15,Alien: Covenant is hitting its R-rating gleefully; here's what's in store.,ign
3,"Fox adds a new live-action sitcom to its Sunday night lineup, but does the TV world really need another time travel series?",ign
3,"Following Betsy DeVos’ confirmation as Secretary of Education, the American education system could drastically pivot in unexpected ways. It’s difficult to..",techcrunch
15,"As over 108,000 attendees from 208 countries filed into the echoing halls of Mobile World Congress last week,  I was reminded of the old First World War..",techcrunch
15,"Roughly 1.2 billion people worldwide are currently learning a foreign language. If you are one of them, this article is for you. Whether you are learning to..",techcrunch
15,"The Naval Criminal Investigative Service (NCIS) has opened an investigation into the online posting of potentially hundreds of explicit photos of current and former female Marines and other service members, CNN has confirmed.",cnn
3,"Alabama lawmakers are meeting Tuesday to explore options for impeaching the state's governor, according to a scheduling posted on the state legislature's website.",cnn
3,"Here we are in March, and it's safe to say many of our preseason predictions were incorrect. What has the regular season taught us about how every major conference tournament will play out?",espn
3,A movie star offers an actress a $10 million marriage contract in a sexy scripted drama that is definitely not about Scientology!,entertainment-weekly
15,"VCs have invested hundreds of millions in messaging companies that either haven’t raised a round for the past couple years, have folded, or don’t show..",techcrunch
3,The FBI asked the Justice Department to publicly rebut President Donald Trump’s claim that he was wiretapped by his predecessor.,the-wall-street-journal
3,"The F.B.I. director wants the Justice Department to refute Mr. Trump’s contention that Barack Obama ordered the tapping of his phones, a claim that Mr. Comey says is false, officials said.",the-new-york-times
6,Francis offers a permanently applicable solution to dealing with outcasts: give.,the-new-york-times
5,"Conservative groups are raising alarms over central provisions of the House GOP’s plan to repeal the Affordable Care Act, pushing lawmakers to buck House Speaker Paul Ryan and oppose the Republican blueprint.",the-wall-street-journal
3,President Donald Trump is expected to sign Monday a revised version of his executive order banning travel of people from certain nations to the U.S.,the-wall-street-journal
3,I credit President Trump — not that he seems any more evolved than the first earthworms now appearing in the cold soil of my garden.,the-new-york-times
15,Here’s what you need to know to start your day.,the-new-york-times
3,"North Korea fired four ballistic missiles into the waters off its east coast Monday morning, South Korea’s Joint Chiefs of Staff said—the latest sign of Pyongyang’s determination to push ahead with its missile program despite increasing pressure against it.",the-wall-street-journal
3,"About 2,700 people had seven-figure compensation packages at charities in 2014, according to a Wall Street Journal review of IRS data, which also found the number of employees receiving that salary level rose about a third from 2011 to 2014",the-wall-street-journal
15,"The Schillers of Houston put their mansion on the market, sold some horses and are plotting a comeback; ‘What other choice is there?’",the-wall-street-journal
15,The United States has been trying to sabotage North Korea’s missile program. President Trump must decide what to do next.,the-new-york-times
4,"In a sensitive political year, China is enlisting old economic growth drivers, betting it can contain mounting financial risks and postpone some painful overhauls.",the-wall-street-journal
3,"As Iraqi forces squeeze Islamic State militants into a fast-shrinking patch of territory in the western half of Mosul, stories of the terror group’s trademark brutality are proliferating.",the-wall-street-journal
3,The first case of highly pathogenic avian influenza to strike a commercial poultry flock in more than a year has been found on a Tennessee chicken farm affiliated with Tyson Foods.,the-wall-street-journal
3,"A group of U.S. senators is examining Marathon Pharmaceuticals LLC’s decision to charge $89,000 in the U.S. for an old steroidal drug that costs a fraction of that overseas, the latest sign of growing scrutiny of the company.",the-wall-street-journal
15,Plans to turn a corner are derailed again as the administration is consumed by controversy.,the-washington-post
15,"Seeking to deflect, he instead raises the stakes in a deepening controversy.",the-washington-post
15,The former director of national intelligence under Obama flatly denied that any wiretap of Trump or his campaign was carried out.,the-washington-post
6,The White House cites five news reports to justify its claim for a congressional probe. But they fail the Pinocchio Test.,the-washington-post
3,Nearly 500 German troops including a Bavarian battle battalion deployed recently in Lithuania near the Russian frontier.,the-washington-post
3,The latest provocation coincides with annual military exercises in South Korea and a congress in China.,the-washington-post
15,Legislation in Kentucky would force a return to neighborhood schools in Louisville.,the-washington-post
15,It is unclear how many service members are involved.,the-washington-post
15,"Exposure to indoor and outdoor air pollution, contaminated water, and other pollution accounts for one of four deaths of children younger than five.",the-washington-post
15,"The deal has raised fears of job losses at Vauxhall's UK factories, which employ 4,500 workers.",bbc-news
5,Lagging national firearms sales are coupled with an interesting twist: Renewed interest in guns among some minorities.,the-washington-post
4,"General Motors said it would sell its European business Opel for $2.3 billion, as the U.S.’s biggest auto maker withdraws from a region where it hasn’t made money for almost two decades.",the-wall-street-journal
3,"South Korean prosecutors provided their most detailed account yet of bribery charges against Samsung’s de facto leader Lee Jae-yong, following a monthslong investigation into a corruption scandal that has shaken the country’s corporate and political elite.",the-wall-street-journal
3,"As a rag-tag bunch of MLB wannabes and has-beens, it would take a Hollywood ending for Israel -- a 200-to-1 underdog -- to win this year's World Baseball Classic.",espn
15,"Social media sites like Twitter, Facebook and Pinterest are causing more people to feel alone, according to US psychologists.",bbc-news
15,"The vice president defended the First Amendment at the annual Gridiron dinner, a gathering of political journalists.",the-washington-post
10,Great Britain win three more golds on the final day of the Para-cycling Track World Championships in Los Angeles.,bbc-sport
15,Which player deserves promotion to the full England squad? And which team made a mistake to let this player leave? Find out in his team of the week.,bbc-sport
15,"The backpacker was attacked repeatedly over two months in locations across Queensland, police say.",bbc-news
3,The Sentinel-2B spacecraft will take pictures to help create a complete map of Earth.,bbc-news
15,"""Diamond"" and ""Silk"" fiercely defend President Trump in an interview with Newsnight's Evan Davis.",bbc-news
15,"A senior MP voices ""grave doubts"" about Facebook's moderation system after a BBC investigation.",bbc-news
15,Tory peer William Hague says Theresa May should go to the country early ahead of Brexit talks.,bbc-news
3,"Why are Eric Gagne, Ryan Dempster and Bruce Chen coming out of retirement to take the mound against hitters nearly half their ages? National -- and personal -- pride.",espn
15,"Meera Syal voices her frustration at how the portrayal of Asians on TV has ""slightly gone backwards"".",bbc-news
15,Chancellor to promise £320m for more free schools and grammars in England.,bbc-news
15,Iraqi forces launch a surprise attack as they press the offensive against so-called Islamic State.,bbc-news
15,Lewis Hamilton looks to continue his strong showing as the first day of the second round of F1 testing gets under way.,bbc-sport
3,"Reaction to Chelsea's win over West Ham and Champions League build-up plus gossip, debate and social media.",bbc-sport
15,Arsenal are 33-1 to overturn a 5-1 first-leg thrashing by Bayern Munich and progress to the Champions League last eight on Tuesday night. How do some other unlikely events compare?,bbc-sport
15,The start of the Thaad deployment comes a day after North Korea launched four ballistic missiles.,bbc-news
3,"Chelsea's players are told to ""go step by step"" by boss Antonio Conte after victory over West Ham took them 10 points clear at the top.",bbc-sport
6,House Republicans' long-awaited plan would end penalties for those who do not buy health insurance.,bbc-news
15,"With his side just having conceded an equaliser away at Catanduvense, striker Mirrai scores directly from the kick-off for Comercial FC who went on to win the game 4-1.",bbc-sport
9,Tony Bellew says he is considering retirement following his thrilling victory over bitter rival David Haye in London on Saturday.,bbc-sport
15,British former heavyweight world champion Tyson Fury suggests on social media that he could be making his comeback on 13 May.,bbc-sport
15,Manchester United striker Zlatan Ibrahimovic and Bournemouth defender Tyrone Mings are charged with violent conduct by the FA.,bbc-sport
15,Preview followed by live coverage of Tuesday's Champions League game between Arsenal and Bayern Munich.,bbc-sport
15,"Team Sky riders are ""100%"" behind team principal Sir Dave Brailsford, according to Geraint Thomas.",bbc-sport
3,"Republicans unveiled their long-awaited legislation to repeal and replace the Affordable Care Act, proposing to phase out key parts of the law over several years as they try to break through a stalemate between moderates and conservatives in their party.",bloomberg
15,The carmaker's latest innovations won't likely make car lovers swoon.,bloomberg
3,Boeing Co. is nearing a decision to build a longer 737 Max targeted for trips from Boston to Los Angeles -- and fill a gap in its product portfolio that Airbus Group SE is exploiting as it racks up order after order for its A321neo.,bloomberg
15,"The president made no statement himself, not even a tweet, and signed the order in private. Its enactment was delayed 10 days.",bloomberg
3,"A day after North Korea’s latest provocation, the U.S. announced that it unloaded two mobile missile launchers in South Korea to start deployment of its Thaad missile-defense system on the peninsula.",bloomberg
15,"After a euphoric market debut, Snap Inc. shares dropped for the first time in three days and fell below the opening price of $24 on their first day of public trading after analysts began weighing in with their thoughts on the company’s true valuation.",bloomberg
15,Yoox Net-a-Porter wants a leg up on the competition.,bloomberg
15,The world's largest energy producer is out of its longest recession in two decades,bloomberg
16,It has outperformed most major commodities.,bloomberg
15,London’s toxic air is bad for business.,bloomberg
3,"Many people could lose coverage under the Republicans' plan to repeal and replace Obamacare. Younger, healthier people who want skimpier plans would likely benefit, but older sicker consumers could pay more.",cnn
3,"Bill would repeal Obamacare's individual mandate, aims to maintain coverage for people with pre-existing conditions, allow children to stay on their parents' plans until the age of 26.",cnn
3,Secretary of Homeland Security John Kelly confirmed that the department is considering separating children from their parents at the border.,cnn
5,"Republicans want to repeal Obamacare, but are they replacing it with Obamacare lite?",cnn
15,"Ann M. Starrs, president and CEO of the Guttmacher Institute, writes that the repeal of the ACA will be the most devastating for the heatlh of women who can least afford it.",cnn
3,"Secretary of Homeland Security John Kelly said that apart from the six countries listed on Monday's travel ban, there are ""13 or 14"" other countries that also have questionable vetting procedures.",cnn
4,"US President Donald Trump signed a new executive order Monday that bans immigration from six Muslim-majority countries, dropping Iraq from January's previous order, and reinstates a temporary blanket ban on all refugees.",cnn
15,"Chick is going full Capote in the Bates household, while Caleb remains firmly on the more losing end of the ‘In Cold Blood’ dynamic",entertainment-weekly
15,Alex and Kara do the wrong things for the right reasons to stop Cadmus,entertainment-weekly
3,"Team Adam’s finally coming together, while Gwen nabs a four-chair favorite",entertainment-weekly
15,"On the heels of his latest album crushing — not, but seriously, crushing — Spotify streaming records following its release as well as a Sunday night performance of his first Billboard Hot 100 No.1 …",entertainment-weekly
15,"This article originally appeared on PEOPLE.com. Chrissy Metz’s This Is Us character Kate keeps an ideal body goal in mind as she continues to try different methods of exercises, even signing …",entertainment-weekly
16,‘Pick your historical analogy.’,entertainment-weekly
15,"This article originally appeared on PEOPLE.com. Adele may have 15 Grammys, but she is still deathly afraid of bugs. The “Rolling In the Deep” singer had a hilarious moment onstage during a concert …",entertainment-weekly
15,"Welcome to Bates Motel’s final season, where the relationship between Norman and Norma Bates is more complicated than ever. (Yes, even now that she’s dead.) So, to help guide you throug…",entertainment-weekly
15,Nick picks his final two before The Women Tell All brings the focus back to Corinne and Taylor,entertainment-weekly
3,Which destinations make the most sense for top players like WR Alshon Jeffery who are about to hit the open market? Matt Bowen finds ideal fits for 14 free agents.,espn
15,"With seven teams separated by eight points and plenty of changes shaking up the teams involved, the race for the drop is wide open in the Prem.",espn
3,"There are so many games this week, it's hard to know which ones impact Selection Sunday the most. Joe Lunardi's looks over Champ Week and finds the games, teams and conferences that matter most.",espn
15,Get the latest NCAA women's college basketball bracketology breakdown from ESPN's Charlie Creme.,espn
4,"The Warriors got a big night from Andre Iguodala, who scored 24 of the team's 55 bench points, the second-highest total from the reserves this season.",espn
15,"In less than a minute on Monday, the Cavaliers went from having a solid veteran backup center in Andrew Bogut to a huge question mark in the middle.",espn
15,"When it comes to home runs, no country has more historical clout than the United States. But it's not the only nation that will bring plenty of pop to this year's World Baseball Classic.",espn
3,"It's a star-studded defensive back class, but on Monday at the NFL combine, we saw some mixed results from the group. Todd McShay breaks down how the big names performed.",espn
15,Nintendo claims Switch sales in the first 48 hours are the best ever for the region.,ign
10,"A blazingly-fast, slickly-presented anti-gravity racer that borrows heavily from Wipeout and F-Zero.",ign
15,Our reviewer's thoughts after a weekend in the wildlands.,ign
10,Your daily roundup of the biggest TechCrunch stories and startup news.,techcrunch
3,"Let us know what you thought of tonight's episode, as Kara and Alex dealt with a major betrayal.",ign
15,The global Creative Assembly team has reportedly now grown to over 500 people.,ign
4,Curious as to how Sonic plays in the original Doom engine? Check out Destin and Mark playing Sonic Robo Blast 2 as part of Mod Mondays.,ign
15,"It looks like AWS, Amazon's cloud computing arm, has made another acquisition to add more productivity tools for its customers beyond basic cloud-computing..",techcrunch
15,The most complete version of this excellent platformer includes a fantastic expansion.,ign
3,"Using a lead, Carter and CTU narrow in on an enemy's location.",ign
